keyword,volume
claiming google knowledge panel,90.0
how to get google knowledge panel,70.0
create google knowledge panel,50.0
create a google knowledge panel,15.18
google knowledge panel example,10.0
distrokid google knowledge panel,10.0
how to get on google knowledge panel,10.0
how to create google knowledge panel,9.82
how to get a google knowledge panel,5.24
get verified on google knowledge panel,4.61
how do i get a knowledge panel on google,3.14
google knowledge panel for artist,3.12
what is a google knowledge panel,3.04
google knowledge panel,2.8
add picture to google knowledge panel,
knowledge panel google erstellen,
personal google knowledge panel,
scrape google knowledge panel,
google knowledge panel wikipedia,
how to get an artist knowledge panel on google,
google knowledge panel update,
google knowledge panel claim,
google scholar knowledge panel,
how to claim a google knowledge panel,
google knowledge panel not showing,
manage google knowledge panel,
google knowledge panel color,
how to change google knowledge panel,
how to claim knowledge panel google,
google artist knowledge panel,
google knowledge panel music,
