keyword,volume
the law building apartments,590.0
homes for sale with in law apartment,320.0
apartment rent increase law,170.0
mother-in-law apartment for rent anchorage,110.0
homes with in law apartments near me,110.0
homes for sale with in law apartment near me,110.0
houses with in law apartments for sale near me,50.0
texas apartment lease laws,50.0
laws about service dogs in apartments,50.0
houses for sale with in law apartment ct,40.0
houses for sale in ct with in law apartment,40.0
mother-in law apartment for rent st george utah,30.0
in-law apartment designs,30.0
utah homes with mother-in law apartments,30.0
homes for sale in utah with mother-in-law apartments,30.0
utah homes with mother-in-law apartments,30.0
roaches in apartment law virginia,30.0
laws on mold in apartments,24.89
apartment camera laws,20.0
apartments with law enforcement discounts near me,20.0
apartment complex towing laws minnesota,20.0
apartment occupancy laws in texas,20.0
mother in law apartment designs,20.0
apartment water damage laws,19.8
california smoking laws apartments 2021,10.99
laws for pet owners living in apartments,10.0
houses for sale in southern maine with in law apartment,10.0
apartments near fordham law,10.0
law of attraction apartment,10.0
homes with in-law apartment for sale,10.0
laws for pet owners living in apartments in india,10.0
pets in apartments law,10.0
nyc apartment smoking laws,10.0
california smoking laws apartments 2018,10.0
northwestern law apartments,10.0
michigan smoking laws apartments,10.0
the hottest home amenity: in-law apartments,10.0
roaches in apartment law nyc,10.0
california apartment carpet law,10.0
roaches in apartment law florida,5.47
roaches in apartment law texas,4.55
california noise law apartments,4.54
arizona apartment laws,4.24
apartment noise complaint laws florida,3.93
no hot water in apartment laws,3.76
in-law apartments for rent south shore ma,3.29
seattle mother in law apartment,3.16
mother-in-law apartment for rent edmonds,2.92
in-law basement apartment ideas,2.85
house with mother-in law apartment for sale near me,2.69
house with mother in law apartment for sale near me,2.69
service animal laws apartments,2.6
nyc apartment law,2.49
in law apartment in san francisco,2.49
mother-in-law apartment for rent denver,2.4
homes with mother in-law apartments,2.23
texas apartment laws,2.17
mother in-law apartment attached to house,2.12
mother in law apartment for rent everett wa,1.99
in law apartment for rent near me,1.9
mother in-law apartment for rent in kirkland,1.89
mother in-law apartment for rent gig harbor,1.88
georgetown law apartments,1.85
in law apartments near me,1.85
mother in law apartment for rent bellevue wa,1.81
apartment rental laws,1.68
in-law apartment for rent,1.64
in-law apartments for rent,1.64
in law apartments for rent,1.64
law enforcement discount apartments,1.64
homes for sale with mother in law apartment near me,1.56
mother-in-law apartments,1.5
mother-in law apartment,1.5
mother-in-law apartment,1.5
homes for sale with mother-in law apartments,1.49
house with mother-in law apartment,1.43
house with mother in law apartment,1.43
house with mother-in-law apartment,1.43
in law apartment for rent ct,1.33
in law apartment for rent in ct,1.33
homes for rent with mother in law apartment,1.26
homes for rent with mother-in law apartment,1.26
in law apartment for rent in ri,1.19
in-law apartment homes for sale,0.97
homes with mother in law apartments plans,0.83
houses with in-law apartments,0.65
houses for sale in shelton ct with in law apartment,0.65
ranch house plans with mother in law apartment,0.28
maharashtra apartment ownership act 1970 bye laws,0.0
mother in law apartment for rent virginia beach va,0.0
apart from the law means,0.0
in law apartment design,
apartment ac not working law,
nj heat laws apartments,
apartment parking laws texas,
apartment repair laws,
houses for sale in southern maryland with in law apartment,
apartment bye laws,
colorado homes for sale with mother in law apartment,
apartment parking laws,
