keyword,volume
sam club gas,301000.0
sam club tires,90500.0
sam club career,40500.0
sam club jobs,27100.0
sam club mattresses,18100.0
sam club vs costco,14800.0
sam club flowers,9900.0
sam club water slide,6600.0
sam club orlando,5400.0
sam club hearing aids,3600.0
sam club oil change,3600.0
sam club shopping,2900.0
sam club king mattress,1900.0
sam club instant savings book,1900.0
sam club chesapeake,1900.0
sam club offer,1900.0
sam club closing time,1600.0
sam club new york,1600.0
gun safes sams club,1600.0
sam club lawn mower,1600.0
sams club cake catalog 2021,1000.0
sam club forest drive,880.0
sam club pa,880.0
sam club 50 inch tv,720.0
sam club humidifier,480.0
seiko clock sams club,390.0
sam club gas quality,320.0
sam club china,320.0
sam club bakery cookies,210.0
sams club cake decorator,210.0
sam club 45 gift card,175.8
good sam club app,110.0
sam club membership coupon,102.36
nearest sam club to my location,95.19
sam club discount,85.7
apply for sam club card,44.98
arboles de navidad sams club,40.0
sam club hours for sunday,40.0
good sam club roadside assistance,35.81
sam club similac,34.66
the nearest sam club,32.9
gas prices at sam club greensboro nc,30.0
how much sam club membership,30.0
sam club in roseville,30.0
gas prices at sam club chattanooga tn,30.0
memberdeals com sams club,26.63
does sams club check your card at the door,21.85
sam club wedding cakes designs,20.0
good sam club my account,20.0
sam club business account application,17.98
sam club one day pass,15.79
sams club aaa membership,13.7
sam club stock,12.5
sam club grocery,12.47
sam club gas station price,11.99
good sam club,11.76
sam club pediasure,11.03
sam club gas prices buford ga,10.25
sam club sweepstakes,10.18
sam club burleson tx,10.09
sams club uppababy,10.0
sams club promo code photo,10.0
sam club san tan village gilbert az,10.0
df sport shoes sams club,10.0
jonesboro arkansas sams club,10.0
sams club boynton beach florida,10.0
sams club moreno valley gas prices,10.0
oso de peluche sams club,10.0
sam club pay levels,10.0
viajes sams club,10.0
sam club dc new braunfels tx,10.0
sams club tuna steaks,10.0
sams club pharmacy duluth mn,10.0
sams club providence,10.0
hangout pod with stand sams club,10.0
hp 564 ink sams club,10.0
good sam club register,10.0
sams club firestick,10.0
sams club at&t customer service,10.0
good sam club membership military,10.0
sams club computer extended warranty,10.0
sam club frozen general tso chicken,10.0
sam club red potato salad recipe,10.0
sams club workday app,10.0
sams club bryson city nc,10.0
sams club optical douglasville ga,10.0
sams club arlington heights il,10.0
sam club in chandler,10.0
mesa de hockey de aire sams club,10.0
sams club metepec horario,10.0
sams club drug test 2022,10.0
sams club dickinson nd,10.0
does sam club sell turkeys,10.0
georgia good sam club,10.0
good sam club mobile app,10.0
good sam club rv parts,10.0
sam club locations madison wi,10.0
sams club pharmacy sherman tx,10.0
how do i get my sam club w2,10.0
sam club auction site reviews,10.0
