keyword,volume
spanish english translate,9140000.0
translation spanish into english,9140000.0
translator english to spanish,9140000.0
translation from spanish to english,9140000.0
translate to english spanish,9140000.0
translating english to spanish,9140000.0
spanish to translation english,9140000.0
spanish translated into english,9140000.0
english spanish translator,9140000.0
spanish to english translation,9140000.0
english to spanish translators,9140000.0
google translate english to spanish,1830000.0
google translate spanish to english,823000.0
spanish to english translation google,823000.0
translate a spanish sentence into english,60500.0
english to spanish sentence translator,60500.0
spanish sentences with english translation,60500.0
free translation spanish to english,40500.0
free translator english to spanish,40500.0
translation spanish into english free,40500.0
free spanish to english translation,40500.0
english to spanish free translation,40500.0
spanish english translation free,40500.0
english to spanish free translator,40500.0
free translation english to spanish,40500.0
translate spanish to english google,33100.0
translating words from spanish to english,12100.0
spanish translation words to english,12100.0
word translator spanish to english,12100.0
english words with spanish translation,12100.0
spanish words in english translation,12100.0
spanish words with english translation,12100.0
spanish to english translation words,12100.0
spanish to english words translation,12100.0
translation of spanish to english words,12100.0
translate spanish to english words,12100.0
spanish translation of english words,12100.0
translation spanish and english,9900.0
translations in spanish and english,9900.0
translator for spanish and english,9900.0
spanish and english translation,9900.0
translator in spanish and english,9900.0
translator in english and spanish,9900.0
translate a spanish sentence to english,8100.0
spanish to english sentence translator,8100.0
sentence translator spanish to english,8100.0
spanish sentences translated to english,8100.0
translation spanish to english text,5400.0
linguee translate english to spanish,3600.0
linguee translate spanish to english,3600.0
translate spanish to english picture,3600.0
translate english to spanish letter,2900.0
spanish translate to english voice,2900.0
translate letter from english to spanish,2900.0
letter translation from english to spanish,2900.0
translate spanish to english speak,2900.0
the best translator english to spanish,2900.0
english spanish translator dictionary,2400.0
translate dictionary english to spanish,1900.0
translation dictionary english to spanish,1900.0
translate english to spanish language,1900.0
how to translate english to spanish,1900.0
english to spanish translator apps,1900.0
spanish-english translation app,1900.0
spanish to english voice translator,1600.0
word translator english to spanish,1600.0
google translate spanish to english picture,1600.0
translate english to spanish in word,1600.0
english spanish voice translator,1600.0
translate english to spanish words,1600.0
spanish to english translation app,1300.0
in spanish to english translator,1300.0
translating documents from english to spanish,1300.0
english to spanish text translation,1300.0
spanish to english letter translator,1300.0
spanish to english translator app,1300.0
english to spanish translation text,1300.0
translate document english to spanish,1300.0
translate letter from spanish to english,1300.0
app for spanish to english translation,1300.0
translating a letter from spanish to english,1300.0
english to spanish voice translation,1000.0
best english spanish translator,1000.0
spanish to english translation app free,1000.0
translate english to spanish sentences,880.0
translate app english to spanish,880.0
spanish to english language translator,880.0
bing translate english to spanish,880.0
translator spanish to english to spanish,880.0
translation english to spanish sentences,880.0
apps for translation english to spanish,880.0
translation spanish to english sentences,880.0
translate phrases from spanish to english,720.0
translate spanish phrases to english,720.0
spanish to english phrase translation,720.0
translate english to spanish phrases,720.0
english spanish phrase translation,720.0
english to spanish phrases translation,720.0
spanish to english translation phrases,720.0
translation to spanish from english phrases,720.0
translate from english to spanish text,720.0
translate to spanish from english phrases,720.0
best english to spanish translation app,590.0
translate spanish songs to english,590.0
spanish songs with english translations,590.0
spanish songs translated in english,590.0
spanish english translation audio,590.0
write english to spanish translation,590.0
translate english to spanish document,590.0
mexican spanish translator to english,590.0
write in english translate to spanish,590.0
google translate english to spanish language,480.0
real spanish to english google translate,480.0
english spanish translation online,480.0
spanish to english translator picture,480.0
translate english to spanish app,480.0
spanish to english translation picture,480.0
spanish to english online translator,480.0
translate english to spain spanish,390.0
translate english to puerto rican spanish,390.0
english spanish dictionary translator,390.0
spanish to english translation jobs,390.0
spanish translator spanish to english,390.0
translate english to spanish spain,390.0
translation spanish english jobs,390.0
translate english to spanish correct grammar,390.0
spanish to english translation passages,390.0
spanish to english translators jobs,390.0
english to spanish translation sentences worksheets,390.0
translation spanish to english document,390.0
translator jobs spanish english,390.0
translate website from english to spanish,320.0
translate english to dominican spanish,320.0
free online translate english to spanish,320.0
translation from english to spanish jobs,320.0
bing translate spanish to english,320.0
voice translator english to spanish,320.0
spanish to english translator text,320.0
free translation online english to spanish,320.0
translate from spanish to english audio,260.0
spanish vs english translation,260.0
birth certificate translation from spanish to english,260.0
translate birth certificate spanish to english,260.0
english to spanish audio translation,260.0
english to spanish translation service,260.0
live translation spanish to english,260.0
songs in spanish translation to english,260.0
english spanish translation services,260.0
perfect english to spanish translator,260.0
english to mexican spanish google translate,260.0
spanish love poems translated to english,260.0
translation of english names to spanish,210.0
english to mexican spanish translation app,210.0
english to spanish name translation,210.0
speak spanish translation to english,210.0
spanish translation english names,210.0
english to spanish names translation,210.0
translate spanish to english jobs,210.0
google translate english to spanish spain,170.0
do you speak english translate to spanish,170.0
ok google translate english to spanish,170.0
translate english to spanish business terms,170.0
spanish to english slang translation,170.0
english spanish to english translation,170.0
spanish english translation slang,170.0
spanish english spanish translation,170.0
translate do you speak english to spanish,170.0
translate english to spanish for me,170.0
translate spanish to english audio free,170.0
english spanish english translator,170.0
systran translate english to spanish,170.0
slang spanish to english translation,170.0
language translator english to spanish,170.0
best translation from spanish to english,170.0
english to slang spanish translation,140.0
google translate english to spanish mexico,140.0
google translate english to dominican republic spanish,140.0
translate word documents from english to spanish,140.0
translate spanish lyrics to english,140.0
translation com english to spanish,140.0
english to spanish paragraph translator,140.0
lyrics translate spanish to english,140.0
quotes about life in spanish with english translation,140.0
translate word document from english to spanish,140.0
translation services english to spanish,110.0
spanish poem with english translation,110.0
english to spanish accurate translator,110.0
spanish poems translated english,110.0
translate english to spanish with accents,110.0
basic english to spanish translation,110.0
translation service english to spanish,110.0
medical translate english to spanish,110.0
google translate english to spanish picture,110.0
translation websites spanish to english,110.0
colombian spanish to english translator,110.0
spanish poetry english translation,110.0
babel fish translator spanish to english,110.0
spanish to english translator speaking,110.0
english to spanish translation time,110.0
online translation spanish to english,110.0
spanish to english english to spanish translator,110.0
google translate english to spanish app,110.0
how to translate english to spanish in word,90.0
funny quotes in spanish with english translation,90.0
yandex translate spanish to english,90.0
speaking spanish to english translator,90.0
certified translation spanish to english,90.0
funny spanish quotes with english translation,90.0
speak english spanish translation,90.0
free translation english to puerto rican spanish,90.0
english to puerto rican spanish translation sentences,90.0
google translate spanish to english english to spanish,90.0
mexican spanish to english translation google,90.0
jobs translating spanish to english,90.0
spanish motivational quotes with english translation,90.0
certified translators spanish to english,90.0
translate english to spanish speaker,90.0
how to translate a video from spanish to english,90.0
spanish quotes with english translation for instagram,90.0
hey google translate spanish to english,90.0
short spanish stories with english translation,70.0
translation of legal documents from spanish to english,70.0
translator english to spanish jobs from home,70.0
translate spanish to english pdf,70.0
tetas translate spanish to english,70.0
translator spanish to english near me,70.0
ok google translate spanish to english,70.0
spanish song lyrics translated to english,70.0
translate english to spanish financial terms,70.0
most accurate english to spanish translation,70.0
translate spanish to english voice app,70.0
spanish words that don't translate to english,70.0
translate song lyrics from spanish to english,70.0
spanish love poems for her with english translation,70.0
download english-spanish translator,70.0
translate english to spanish jobs online,70.0
translate word document from spanish to english,70.0
online translation jobs english to spanish,70.0
online spanish english translation jobs,70.0
download english to spanish translation,70.0
spanish short stories translated to english,70.0
how to translate a pdf from spanish to english,50.0
spanish to english translation website,50.0
spanish to english certified translation,50.0
dictionary translation spanish to english google,50.0
english to spanish song translation,50.0
is there an app to translate english to spanish,50.0
translate english to cuban spanish,50.0
google translate argentinian spanish to english,50.0
free spanish to english translation app,50.0
google translate english to spanish speaking,50.0
translate spanish to english app free,50.0
will translate english to spanish,50.0
dictionary english spanish translation free,50.0
best english to spanish translation device,50.0
spanish to english pdf translation,50.0
google translate english to spanish microphone,50.0
translate english to spanish in word document,50.0
translate english to spanish free app,50.0
english to spanish translation app download,50.0
spanish love songs for her with english translation,50.0
spanish to english translation sentences for beginners,50.0
translate document from english to spanish in word,50.0
marriage certificate translation template spanish to english,50.0
google translate english to spanish dominican,50.0
how to translate spanish to english on messenger,50.0
translate spanish to english picture app,50.0
translate english to salvadoran spanish,50.0
certified translator spanish to english near me,40.0
translate english to spanish and spanish to english,40.0
translation practice english to spanish,40.0
google translate english to spanish speaker,40.0
translate video spanish to english,40.0
legal terms translation spanish to english,40.0
english to spanish translation keyboard app,40.0
translator spanish to english jobs from home,40.0
spanish to english listening translation,40.0
diablo translation spanish english,40.0
translate castilian spanish to english,40.0
english to tex mex spanish translation,40.0
list of spanish words with english translation,40.0
legal translator spanish to english,40.0
spanish to english translation camera,40.0
translate spanish to english google chrome,40.0
live english to spanish translation,40.0
legal translation spanish to english,40.0
google translate app spanish to english,40.0
babylon translate english to spanish,40.0
translate spanish to english live,40.0
spanish words list with english translation,40.0
translation spanish to english jobs from home,40.0
best english to spanish translation app for android,40.0
spanish to english document translation services near me,40.0
english to spanish translation picture,40.0
legal translation from spanish to english,40.0
best english to spanish translation website,40.0
translate english to ecuador spanish,40.0
translate a pdf document from english to spanish,40.0
listen to spanish translation to english,40.0
professional translation spanish to english,40.0
how to translate spanish to english on iphone,40.0
translate english to spanish text for free,40.0
practice translating english to spanish,40.0
please translate english to spanish,30.0
from english to spanish free translation,30.0
translate email spanish to english,30.0
translate spanish to english from picture,30.0
mamando spanish-english translation,30.0
el salvador spanish to english translation,30.0
best english to spanish translation app free,30.0
spanish alphabet with english translation,30.0
translate english to spanish sayings,30.0
captions in spanish with english translation,30.0
google translate documents english to spanish,30.0
english to spanish translation full sentences,30.0
mamando spanish english translation,30.0
can siri translate spanish to english,30.0
translate from english to spanish mexico,30.0
spanish translation to english audio,30.0
how to translate a text message from spanish to english,30.0
translate english to spanish image,30.0
translate to english into spanish,30.0
is there an app to translate spanish to english,30.0
dominó spanish translation to english,30.0
english to spanish speech translator,30.0
english to spanish professional translation,30.0
idiom translation english to spanish,30.0
what is the best english to spanish translator,30.0
time translator english to spanish,30.0
get paid to translate english to spanish,30.0
translate english to spanish word document free,30.0
best way to translate english to spanish,30.0
google translate spanish to english picture app,30.0
funny english to spanish translations,30.0
english to dominican republic spanish translation,30.0
encanto spanish to english translation,30.0
spanish sayings with english translation,30.0
franklin spanish english translator,30.0
medical terminology translation english to spanish,30.0
english to spanish voice translator device,30.0
venezuela spanish to english translation,30.0
translate english to spanish audio free,30.0
translate english to spanish take a picture,30.0
google translate spanish to english talking,30.0
spanish verbs list with english translation,30.0
translate english to spanish live,30.0
colombian spanish translation to english,30.0
translate from english to puerto rican spanish,20.0
suavecito translation from spanish to english,20.0
mi corazon translation spanish english,20.0
spanish quotes about friendship with english translation,20.0
english sight words with spanish translation,20.0
spanish words that start with q with english translation,20.0
free translation english to spanish app,20.0
how to translate spanish website to english,20.0
chiflada translation from spanish to english,20.0
translate spanish to english numbers,20.0
sale translation spanish to english,20.0
phrases in spanish that don't translate to english,20.0
free english to spanish translation app for iphone,20.0
divorce decree translation from spanish to english,20.0
translate spanish to english device,20.0
colors in spanish translation to english,20.0
google translate english to spanish image,20.0
spanish words that start with w with english translation,20.0
translate english to spanish text app,20.0
google translate english to spanish numbers,20.0
can you translate spanish into english,20.0
google translate latin american spanish to english,20.0
spanish english translation certificate program online,20.0
english spanish translator jobs from home,20.0
app to translate english to spanish free,20.0
translate conversation from spanish to english,20.0
spanish love songs with english translation,20.0
spanish english translation and interpretation program,20.0
google translate spanish to english image,20.0
translate la quinta from spanish to english,20.0
cuban spanish to english translation,20.0
translate a book from english to spanish,20.0
english to spanish translation app for iphone,20.0
translate pdf spanish to english online free,20.0
how to translate pdf from english to spanish,20.0
certified translation english to spanish,20.0
dile al amor lyrics in spanish and english translation,20.0
spanish words that start with p with english translation,20.0
spanish-english translation and interpretation program,20.0
arriva translate spanish to english,20.0
need translation from english to spanish,20.0
translate dime from spanish to english,20.0
translate spanish to english certification,20.0
spanish quotes about god with english translation,20.0
siri translate spanish to english,20.0
translate spanish to english free app,20.0
offline english to spanish translation app for android,20.0
spanish words that start with u with english translation,20.0
google translate english to argentinian spanish,20.0
english to el salvador spanish translation,20.0
translate pico de gallo from spanish to english,20.0
spanish conversation script with english translation,20.0
cabo translation spanish english,20.0
how do i translate a document from english to spanish,20.0
translation of despacito spanish to english,20.0
spanish video to english translation,20.0
translation software english to spanish,20.0
translate gallo from spanish to english,20.0
english to spanish document translation services near me,20.0
colina spanish to english translation,20.0
an app that translates english to spanish,20.0
google translate colombian spanish to english,20.0
translate english to spanish i love you,20.0
translate english to european spanish,20.0
english to costa rican spanish translator,20.0
translate english to spanish with pictures,20.0
polla translate spanish to english,20.0
alago translate spanish to english,20.0
amor prohibido spanish to english translation,20.0
spanishdict translate english to spanish,20.0
monitos translate spanish to english,20.0
how to translate a voice message from spanish to english,20.0
yahoo translate english to spanish,20.0
spanish slang words translation to english,20.0
translate english to proper spanish,20.0
english 2 spanish translation google,20.0
translate english to spanish pdf documents,20.0
english to latin spanish translation,20.0
spanish poem about love with english translations,10.0
english to spanish translation services rates,10.0
agave translation spanish-english,10.0
translate a voicemail from spanish to english,10.0
what is the best app to translate english to spanish,10.0
how to translate sentences from english to spanish,10.0
spanish words and english translation,10.0
google translate english to spanish conjugation chart,10.0
spanish to english translation software free download,10.0
chabacano spanish to english translation,10.0
translate english to spanish context,10.0
tango translation spanish to english,10.0
translate english to spanish sdl,10.0
spanish to english article translation,10.0
translate from english to spanish and spanish to english,10.0
english to spanish translation jobs from home,10.0
translate spanish to english music,10.0
spanish english translator apk,10.0
technical translation english to spanish,10.0
english to spanish translation rules,10.0
where can i translate english to spanish,10.0
spanish to english audio translator free,10.0
english to spanish translation camera,10.0
how to translate a marriage certificate from spanish to english,10.0
list of irregular verbs in english with spanish translation pdf,10.0
electronic translator spanish to english,10.0
dialogue in spanish with english translation,10.0
how to translate a pdf document from english to spanish,10.0
mercedes translation spanish to english,10.0
spanish paragraph to read with english translation,10.0
spanish to english pdf translator online,10.0
spanish to english translation verbal,10.0
free english to spanish voice translator,10.0
translate hacer from spanish to english,10.0
diego in spanish to english translation,10.0
spanish tongue twisters with english translation,10.0
english to spanish certified translation,10.0
translate spanish to english using camera,10.0
lo mejor esta por venir translate spanish to english,10.0
translate argentina spanish to english,10.0
translate marriage certificate from spanish to english template,10.0
how to translate a powerpoint presentation from english to spanish,10.0
translate spanish to english sound,10.0
translate english to bolivian spanish,10.0
spanish to english translation agency,10.0
english to spanish translation in writing,10.0
translate spanish to english with voice,10.0
adiós muchachos translation spanish to english,10.0
translate from spanish to english please answers,10.0
free text translation from english to spanish,10.0
equis translation spanish-english,10.0
translate british english to spanish,10.0
reliable spanish to english translator,10.0
spanish to english vaccine translation,10.0
punto translation spanish english,10.0
spanish english electronic translator speaking,10.0
english to spanish bible translation niv,10.0
english to spanish translation masculine and feminine,10.0
translation english to spanish medical terms,10.0
translate buscar from spanish to english,10.0
spanish words that start with r with english translation,10.0
type in english and translate to spanish,10.0
overboard movie spanish to english translation,10.0
long spanish to english translator,10.0
best translator english spanish,10.0
spanish to english translation toronto,10.0
spanish idioms translated to english,10.0
cual es tu nacionalidad spanish to english translation,10.0
translate spanish crochet pattern to english,10.0
translate spanish to english speak online,10.0
google translate from spanish to english please,10.0
spanish news translated into english,10.0
google dictionary spanish to english translation,10.0
famous spanish quotes about life with english translation,10.0
tinto translation spanish english,10.0
kayate spanish to english translation,10.0
english to spanish future tense translation,10.0
most accurate english to spanish translation website,10.0
translate google form from english to spanish,10.0
travel quotes in spanish with english translation,10.0
best spanish to english translation software,10.0
translate an article from spanish to english,10.0
translate medical terms english to spanish,10.0
english to spanish translation english to spanish translation,10.0
translate spanish to english speak app,10.0
equis translation spanish english,10.0
romantic spanish phrases with english translation,10.0
argentina spanish translation to english,10.0
cute love quotes in spanish for him with english translation,10.0
mira translation spanish english,10.0
estamos bien translate spanish to english,10.0
spanish to english meaning translation,10.0
latin spanish to english translation,10.0
popular spanish songs translated to english,10.0
ponte las pilas translation spanish to english,10.0
can alexa translate from english to spanish,10.0
translate text spanish to english for free,10.0
google translate english to argentina spanish,10.0
salado translation spanish to english,10.0
sdl translation english to spanish,10.0
funny translations from spanish to english,10.0
english to proper spanish translation,10.0
translate english to spanish lyrics,10.0
translate english to mexican dialect spanish,10.0
translate y tu from spanish to english,10.0
english to spanish and spanish to english translator,10.0
translate english to spanish copy and paste,10.0
freelance translator spanish to english,10.0
translation english to spanish price,10.0
tranqui spanish english translation,10.0
translate cervantes spanish to english,10.0
android app to translate english to spanish,10.0
google translate english to spanish online,10.0
translate english to spanish in voice,10.0
translate diego from spanish to english,10.0
translate spanish to english wordreference,10.0
