keyword,volume
tagalog to english to spanish translation,10.0
translate spanish to english jobs online,10.0
mimi translation spanish to english,10.0
attitude status in spanish with english translation,10.0
spanish love quotes with english translation tumblr,10.0
pinta translate spanish to english,10.0
microphone spanish to english translation,10.0
best english to spanish translator reddit,10.0
spanish to english listen and translate,10.0
spanish to english translation download free,10.0
i don't speak spanish translate to english,10.0
record spanish translate to english,10.0
spanish to english translation app for iphone,10.0
how to translate from spanish to english in word,10.0
spanish news with english translation,10.0
english to spanish past tense translation,10.0
translate spanish to english i love you,10.0
translate english to spanish verbally,10.0
how to translate a spanish letter to english,10.0
articles translated from english to spanish,10.0
spanish to english professional translation,10.0
spanish to english translation on google,10.0
translate cotorro from spanish to english,10.0
translate samba pa ti from spanish to english,10.0
app that translates audio spanish to english,10.0
no tango translation spanish to english,10.0
automatic translation from spanish to english,10.0
chocha translation spanish to english,10.0
translate spanish passage to english,10.0
translate excel spanish to english,10.0
spanish to english audio translation online,10.0
spanish slang that doesn t translate to english well,10.0
translate english to spanish offline,10.0
how to translate english to spanish in writing,10.0
translate mota from spanish to english,10.0
enfermo translate spanish to english,10.0
one word quotes in spanish with english translation,10.0
translate english to spanish e,10.0
english to spanish document translation google,10.0
nintendo translate spanish to english,10.0
spanish sad quotes with english translation,10.0
english spanish translator jobs remote,10.0
sample translation contract spanish english,10.0
transcript translation spanish to english,10.0
english to spanish translation how are you,10.0
translate alcatraz from spanish to english,10.0
english to barcelona spanish translation,10.0
english to spanish colors translation,10.0
spanish to english translation work,10.0
youtube english to spanish translation,10.0
english to uruguay spanish translation,10.0
professional translation services spanish to english,10.0
easy spanish words translated english,10.0
spanish to english notarized translation,10.0
translate mija spanish english,10.0
what does chula mean spanish to english translation,10.0
spanish to english translation rates,10.0
english to spanish accent translation,10.0
translate nicaragua spanish to english,10.0
translate english to spanish past tense,10.0
spanish to english medical terms translation,10.0
welita spanish english translation,10.0
cervantes spanish translation to english,10.0
vuelta translate from spanish to english,10.0
english to spanish meaning translation,10.0
la vida sigue translation spanish to english,10.0
english to spanish translation imtranslator,10.0
www dictionary translation english to spanish,10.0
software to translate spanish to english,10.0
how to translate english to spanish in word document,10.0
spanish poems with english translation about friendship,10.0
google translate english to puerto rican spanish,10.0
mi vida translation spanish english,10.0
google translate dominican spanish to english,10.0
hey julio iglesias spanish lyrics english translation,10.0
youtube translate english to spanish,10.0
free online pdf translator spanish to english,10.0
bimbo spanish to english translation,10.0
english to spanish translation cost per word,10.0
what's the best english to spanish translation,10.0
translate spanish to english google toolbar,10.0
por vida ese spanish to english translation,10.0
checo spanish translation to english,10.0
translate from english to spanish photo,10.0
rough in spanish to english translation,10.0
spanish quotes about love translated to english,10.0
lunch spanish to english translation,10.0
spanish dictionary translate english to spanish,10.0
translate voicemail from spanish to english,10.0
spanish quotes for instagram bio with english translation,10.0
legal spanish to english translation,10.0
chula hermosa translation spanish to english,10.0
english to spanish translation list,10.0
cool spanish quotes with english translation,10.0
translate english to spanish quiz,10.0
english to ecuadorian spanish translation,10.0
apps that translate english into spanish,10.0
speak english translate to spanish app,10.0
translate soy from spanish to english,10.0
technical translation english spanish,10.0
linguee spanish to english translation,10.0
friendship short spanish poems with english translation,10.0
translate english to spanish video,10.0
sobador spanish-english translation,10.0
how to translate a diploma from spanish to english,10.0
microsoft english to spanish translation,10.0
english to spanish translation sentences worksheets pdf with answers,10.0
translate spanish to english uk,10.0
free text translation english to spanish,10.0
translate lyrics from english to spanish,10.0
spanish proverbs with english translation,10.0
spanish to english translator babylon,10.0
gorda spanish english translation,10.0
how to translate a picture from spanish to english,10.0
in english spanish translation,10.0
buchanan's translation spanish to english,10.0
translate english to spanish or spanish to english,10.0
honduran spanish to english translation,10.0
image translator spanish to english,10.0
children's stories in spanish with english translation,10.0
free birth certificate translation template from spanish to english,10.0
ventura translation spanish to english,10.0
translate spanish to english in context,10.0
translation book spanish to english,10.0
best online translator english to spanish,10.0
translate from english to spanish pdf,10.0
pura vida translation spanish to english,10.0
translate english to formal spanish,10.0
translate spanish to english birth certificate template,10.0
spanish novels with english translation,10.0
spanish words that start with ch with english translation,10.0
translation english to spanish proper names,10.0
mas translation spanish english,10.0
translate spanish to english talking,10.0
proper spanish to english translation,10.0
translate chino from spanish to english,10.0
translation tool spanish to english,10.0
translate english to spanish my name is,10.0
menudo translation spanish english,10.0
google translate english to spanish offline,10.0
translate rompope from spanish to english,10.0
spanish to english business translation,10.0
printable english to spanish translation,10.0
how to translate spanish to english in whatsapp,10.0
free spanish short stories with english translation,10.0
la quinta translation spanish english,10.0
english to spanish business translation,10.0
medical english to spanish translation,10.0
peruvian spanish to english translation,10.0
translate english to mexican spanish online,10.0
quick english to spanish translation,10.0
english to catalan spanish translation,10.0
loquita translation spanish to english,10.0
english to spanish subjunctive translator,10.0
spanish to english slow translation,10.0
wordreference translate spanish to english,10.0
manual of spanish english translation kelly washbourne pdf,10.0
translate english to spanish and,10.0
cerebro translate spanish english,10.0
spanish quotes about education with english translation,10.0
program to translate spanish to english,10.0
rosamunda spanish story english translation,10.0
gringo translation spanish to english,10.0
spanish lullaby with english translation,10.0
english to spanish translation imperfect tense,10.0
translate i speak english to spanish,10.0
how to translate a youtube video from english to spanish,10.0
propuesta indecente translation spanish to english,10.0
translation rate per word english to spanish,10.0
spanish to english collins translator,10.0
every word in spanish translated to english,10.0
marriage certificate translation from spanish to english template,10.0
spanish to english translation machine,10.0
patron translation spanish to english,10.0
quieres tener sexo spanish to english translation,10.0
translate spanish to english definition,10.0
spanish to english translation test,10.0
software to translate documents from english to spanish,10.0
english to spanish translation machine,10.0
goro spanish to english translation,10.0
certified translation spanish to english uk,10.0
translate english to spanish you,10.0
translate idiomatic expressions from spanish to english,10.0
freelance spanish to english translation jobs,10.0
professional spanish to english translation,10.0
translate spanish to english url,10.0
spanish to english yandex translate,10.0
rut spanish to english translation,10.0
calientes translate spanish to english,10.0
spanish words that are hard to translate into english,10.0
how to translate from spanish to english on messenger,10.0
hija translation spanish english,10.0
google translate spanish to english h,10.0
panocha translation spanish to english,10.0
spanish love sayings with english translation,10.0
baja translation spanish-english,10.0
haste translation spanish to english,10.0
english to spanish preterite translator,10.0
spanish to english translation conjugation,10.0
keyboard that translates english to spanish,10.0
english spanish electronic translator best buy,10.0
sad spanish love quotes with english translation,10.0
spanish to english audio translation app,10.0
chavala spanish english translation,10.0
list of common spanish words with english translation,10.0
acabando spanish to english translation,10.0
google translate website spanish to english,10.0
online translation courses spanish to english,10.0
translate english to spanish in preterite tense,10.0
linda spanish to english translation,10.0
google translate english to spanish slang,10.0
free birth certificate translation template from english to spanish,10.0
english to spanish translation voice online,10.0
rusa spanish translation to english,10.0
translate diploma from spanish to english,10.0
translation fees english to spanish,10.0
las vegas in english translation spanish,10.0
chile spanish to english translation,10.0
spanish to english instant translation,10.0
translation rates per word spanish to english,10.0
spanish to english medication translation,10.0
mayor spanish to english translation,10.0
free legal translation spanish to english,10.0
spanish to english translation cambridge,10.0
translate italian from spanish to english,10.0
correct spanish to english translation,10.0
adios muchachos translation spanish to english,10.0
spanish english translator app no internet,10.0
english spanish translator job,10.0
english to spanish translation google play,10.0
colombian spanish to english translation online,10.0
how to translate english to spanish on facebook messenger,10.0
translate i love you from english to spanish,10.0
google translate english to spanish mic,10.0
english spanish electronic translator,10.0
free translation english to spanish latin american,10.0
spanish to english legal document translation,10.0
webster dictionary translate english spanish,10.0
spanish sayings translated into english,10.0
spanish to english microphone translator,0.83
english to spanish medical translator,0.61
english to spanish translation tool,0.61
spanish to english translation essay,0.5
translate document from english to spanish,0.47
document translation from english to spanish,0.47
translate legal documents from spanish to english,0.46
english to spanish translation document,0.44
how to translate a death certificate from spanish to english,0.44
english to spanish translation costs,0.43
translating documents from english to spanish jobs,0.43
translate scanned document from spanish to english,0.43
english to spanish speaking translator app,0.43
google translate spanish to english with voice,0.43
oral spanish to english translation,0.43
english to spanish voice translation app,0.43
speak spanish and translate to english,0.42
speak and translate spanish to english,0.42
i need a translator from spanish to english,0.42
app for translation from english to spanish,0.42
spanish to english translator app free download,0.41
free app for english to spanish translation,0.41
translate english to spanish jobs from home,0.4
translate english to spanish with picture,0.39
english to spanish legal translation,0.39
how to translate audio from spanish to english,0.38
spanish to english translation app for android,0.36
english to spanish translation apps,0.36
spanish to english translation jobs online,0.35
translate spanish conversation to english,0.35
translate spanish to english real time,0.35
online translator jobs english to spanish,0.35
english to spanish document translation software,0.34
spanish to english voice translator online,0.34
spanish to english picture translate,0.34
translate spanish to english take a picture,0.34
english to spanish translation app iphone,0.33
english spanish translator with voice,0.33
spanish english translator voice,0.33
spanish english voice translator,0.33
english to spanish translation companies,0.33
birth certificate translated from spanish to english,0.32
best english to spanish translation apps,0.32
free english to spanish document translation,0.31
spanish english translation jobs from home,0.31
translation english to spanish jobs,0.31
speak in spanish translate to english,0.3
spanish conversation with english translation,0.29
upwork translation english to spanish,0.29
translate english to spanish birth certificate template,0.28
spanish books translated to english,0.27
talk translate spanish to english,0.26
translate my english into spanish,0.25
death certificate translation from spanish to english sample,0.25
translate spanish to english text message,0.24
perfect translation english to spanish,0.24
free professional translation english to spanish,0.2
translate from english to spanish free in google,0.2
puerto rican spanish translation to english,0.2
spanish to english pdf translator,0.2
english to spanish money translation,0.19
translate spanish pdf to english,0.19
translate a song from spanish to english,0.18
how to translate an email from spanish to english,0.18
free spanish to english translation google,0.18
free english to spanish essay translation,0.17
spanish to english translation accurate,0.16
english to dominican spanish translation,0.15
translate english to costa rican spanish,0.14
translate catalan spanish to english,0.14
accurate spanish to english translator,0.14
love letters in spanish with english translation,0.14
read spanish with english translation,0.13
phrase translator english to spanish,0.13
english to spanish translation websites,0.13
marriage certificate translation from spanish to english sample,0.12
practice translating spanish to english,0.12
best english to spanish translation online,0.12
translate english to mexican spanish free,0.12
common spanish words translated to english,0.12
spanish phrase translation to english,0.11
google translate spanish to english microphone,0.1
translate english to spanish translate spanish to english,0.09
english to colombian spanish translation,0.08
translate argentinian spanish to english,0.08
english to puerto rican spanish translator,0.08
spanish lyrics translated to english,0.08
spain spanish translation to english,0.08
free translate from spanish to english,0.08
instant spanish to english translation,0.08
english to spanish translator free,0.08
english to spanish translation proper grammar,0.07
bolivian spanish to english translation,0.07
google translate english to chile spanish,0.07
english to spanish translation essay,0.07
real spanish to english translate,0.07
babel fish english to spanish translation,0.07
google translate english to spanish with accent marks,0.07
translation from spanish to english sentences,0.07
english to peruvian spanish translation,0.06
translate spanish slang to english,0.06
spanish inspirational quotes with english translation,0.06
european spanish to english translator,0.06
yahoo translate spanish to english,0.06
translation for spanish to english text,0.06
english to spanish word translation,0.06
translation english to argentinian spanish,0.05
oraciones translate spanish to english,0.05
spanish to english urban translation,0.05
translate from english to spanish google,0.05
dictionary translate in spanish to english,0.05
english to spanish translation images,0.05
translate english to spanish sentences practice,0.04
english to spanish translation sentences google,0.04
translate english into spanish sentences,0.04
english to mexican spanish translation,0.04
can word translate english to spanish,0.04
spanish translation to english words,0.04
english 2 spanish translator,0.03
webster translate spanish to english,0.03
spanish to english numbers translation,0.03
translation from spanish to english dictionary,0.03
spanish to english dictionary translator,0.03
google translate english to spanish informal,0.03
recipes in spanish language with english translation,0.02
translator to english to spanish,0.01
spanish love poems with english translation,0.01
english to spanish slang translation,0.01
translate english to spanish only,0.01
spanish words that start with x with english translation,0.01
motivational quotes in spanish with english translation,0.01
google translate from spanish to english,0.01
funny spanish phrases with english translation,0.01
translate english to spanish slang,0.01
www english spanish translation,0.01
spanish translation english,0.01
translate english to spanish feminine,0.01
spanish translate into english,0.01
